name,price,url
Sainsbury's Oranges,30p,https://www.sainsburys.co.uk/shop/gb/groceries/product/details/sainsburys-oranges
Sainsbury's Conference Pear Single,45p,https://www.sainsburys.co.uk/shop/gb/groceries/product/details/sainsburys-conference-pear-single
Sainsbury's Braeburn Apple Single,35p,https://www.sainsburys.co.uk/shop/gb/groceries/product/details/sainsburys-braeburn-apple-single
Sainsbury's Pink Lady Apple Single,50p,https://www.sainsburys.co.uk/shop/gb/groceries/product/details/sainsburys-pink-lady-apple-single-c
Sainsbury's Royal Gala Apple Single,35p,https://www.sainsburys.co.uk/shop/gb/groceries/product/details/sainsburys-british-royal-gala-apple-single-c
Sainsbury's Granny Smith Apples Single,35p,https://www.sainsburys.co.uk/shop/gb/groceries/product/details/sainsburys-granny-smith-apples-single-c
Sainsbury's Large Kiwi Fruit Single,30p,https://www.sainsburys.co.uk/shop/gb/groceries/product/details/sainsburys-large-kiwi-fruit-single
Sainsbury's Easy Peeler (each),30p,https://www.sainsburys.co.uk/shop/gb/groceries/product/details/sainsburys-easy-peeler-each-
Sainsbury's Dried Apricots 40g,80p,https://www.sainsburys.co.uk/shop/gb/groceries/product/details/sainsburys-apricots-40g
Marmite Rice Cakes 25g,£1.00,https://www.sainsburys.co.uk/shop/gb/groceries/product/details/marmite-rice-cakes-25g
Arla Blueberry High Protein Yogurt 200g,£1.25,https://www.sainsburys.co.uk/shop/gb/groceries/product/details/arla-protein-blueberry-yogurt-200g
Graze Snack Box Oat Boosts Lemon Drizzle Flapjack 50g,£1.20,https://www.sainsburys.co.uk/shop/gb/groceries/product/details/graze-snack-box-lemon-drizzle-flapjack-53g
Graze Snack Box Chilli & Lime Punchy Protein Mixed Nuts 38g,£1.20,https://www.sainsburys.co.uk/shop/gb/groceries/product/details/graze-snack-box-punchy-protein-nuts-35g
Cadbury Starbar Chocolate Bar 49g,£1.05,https://www.sainsburys.co.uk/shop/gb/groceries/product/details/cadbury-starbar-49g
Graze Snack Box Oat Boosts Cocoa & Vanilla Flapjack 50g,£1.20,https://www.sainsburys.co.uk/shop/gb/groceries/product/details/graze-cocoa---vanilla-protein-flapjack-54g
Cadbury Dairy Milk Chocolate Buttons 40g,£1.05,https://www.sainsburys.co.uk/shop/gb/groceries/product/details/cadbury-giant-dairy-milk-buttons-bag-40g
Big Hoops Salted Grab Bag Crisps 45g,£1.10,https://www.sainsburys.co.uk/shop/gb/groceries/product/details/hula-hoops-big-hoops-original-potato-rings-50g
NOMO Vegan & Free From Caramel Chocolate Bar 38g,£1.20,https://www.sainsburys.co.uk/shop/gb/groceries/product/details/nomo-vegan-free-from-caramel-chocolate-bar-38g
Mars Caramel Nougat & Milk Chocolate Snack Bar 51g,95p,https://www.sainsburys.co.uk/shop/gb/groceries/product/details/mars-single-bar-58g
Trek Cocoa Oat Protein Flapjack 50g,£1.65,https://www.sainsburys.co.uk/shop/gb/groceries/product/details/trek-cocoa-oat-flapjack-50g
Big Hoops BBQ Beef Grab Bag Crisps 45g,£1.10,https://www.sainsburys.co.uk/shop/gb/groceries/product/details/hula-hoops-big-hoops-bbq-potato-rings-50g
Batchelors Big Super Noodles Pot Chicken Flavour 100g,£1.20,https://www.sainsburys.co.uk/shop/gb/groceries/product/details/batchelors-big-super-noodles-chicken-flavour-100g
Cadbury Crunchie Chocolate Bar Single 40g,£1.05,https://www.sainsburys.co.uk/shop/gb/groceries/product/details/cadbury-crunchie-bar-40g
Pringles Original Crisps Can 40g,£1.05,https://www.sainsburys.co.uk/shop/gb/groceries/product/details/pringles-original-40g
KIND Dark Chocolate Nuts & Sea Salt Snack Bar 40g,£1.40,https://www.sainsburys.co.uk/shop/gb/groceries/product/details/kind-nuts---spices-dark-chocolate-nuts---sea-salt-bar-40g
Sainsbury's Pistachio Nuts 35g,90p,https://www.sainsburys.co.uk/shop/gb/groceries/product/details/sainsburys-pistachio-nuts-35g
Lindt Lindor Treat Bar 38g,£1.30,https://www.sainsburys.co.uk/shop/gb/groceries/product/details/lindt-lindor-treat-bar-38g
Nik Naks Nice'N'Spicy Grab Bag Crisps 45g,£1.10,https://www.sainsburys.co.uk/shop/gb/groceries/product/details/kp-nik-naks-nice-n-spicy-grab-bag-50g
Maltesers Milk Chocolate & Honeycomb Snack Bag 37g,95p,https://www.sainsburys.co.uk/shop/gb/groceries/product/details/maltesers-standard-bag-37g
Walkers Ready Salted Crisps 45g,£1.10,https://www.sainsburys.co.uk/shop/gb/groceries/product/details/walkers-ready-salted-crisps-45g
"Sainsbury's On the Go Apple, Grape & Strawberry 135g",£1.35,https://www.sainsburys.co.uk/shop/gb/groceries/product/details/sainsburys-ftg-apple-grape-strawberry-135g
Cadbury Boost Chocolate Bar 48.5g,£1.05,https://www.sainsburys.co.uk/shop/gb/groceries/product/details/cadbury-boost-glucose
Pringles Sour Cream & Onion Crisps Can 40g,£1.05,https://www.sainsburys.co.uk/shop/gb/groceries/product/details/pringles-sour-cream---onion-40g
Cadbury Twirl Chocolate Bar Single 43g,£1.05,https://www.sainsburys.co.uk/shop/gb/groceries/product/details/cadbury-twirl-43g
Cadbury Dairy Milk Chocolate Bar 45g,£1.05,https://www.sainsburys.co.uk/shop/gb/groceries/product/details/cadbury-dairy-milk-chocolate-45g
Sainsbury's Toasted Sunflower & Pumpkin Seed Mix 30g,60p,https://www.sainsburys.co.uk/shop/gb/groceries/product/details/sainsburys-toasted-sunflower---pumpkin-seeds-30g
Walkers Quavers Cheese Crisp Snacks 34g,£1.10,https://www.sainsburys.co.uk/shop/gb/groceries/product/details/walkers-quavers-cheese-crisp-snacks-34g
KitKat Chunky Peanut Butter Milk Chocolate Bar 42g,95p,https://www.sainsburys.co.uk/shop/gb/groceries/product/details/kit-kat-chunky-peanut-butter-chocolate-bar-42g-7731117-p
Sainsbury's On the Go Free Range Egg Protein Pot Meal Snack 90g,£1.30,https://www.sainsburys.co.uk/shop/gb/groceries/product/details/sainsburys-on-the-go-free-range-egg-protein-pot-meal-snack-90g
Walkers Cheese & Onion Crisps 45g,£1.10,https://www.sainsburys.co.uk/shop/gb/groceries/product/details/walkers-cheese-onion-crisps-50g
Cadbury Wispa Chocolate Bar 36g,£1.05,https://www.sainsburys.co.uk/shop/gb/groceries/product/details/cadbury-wispa-bar
Reese's Peanut Butter Cups x2 42g,£1.00,https://www.sainsburys.co.uk/shop/gb/groceries/product/details/reeses-peanut-butter-cups-x2-42g
Sainsbury's Carrot & Houmous 100g,£1.30,https://www.sainsburys.co.uk/shop/gb/groceries/product/details/sainsburys-carrot-houmous-100g
Sainsbury's On The Go Vegetable Samosas x2,£1.30,https://www.sainsburys.co.uk/shop/gb/groceries/product/details/sainsburys-on-the-go-vegetable-samosa
Walkers Max Crisps Paprika 50g,£1.10,https://www.sainsburys.co.uk/shop/gb/groceries/product/details/walkers-max-crisps-paprika-50g
Walkers Max Flame Grilled Steak Crisps 50g,£1.10,https://www.sainsburys.co.uk/shop/gb/groceries/product/details/walkers-max-flame-grilled-steak-50g
Rhythm 108 Creamy Coconut with Swiss Dark Chocolate 33g,£1.50,https://www.sainsburys.co.uk/shop/gb/groceries/product/details/rhythm-108-gluten-free-super-coconut-swiss-dark-chocolate-33g
KIND Caramel Almond & Sea Salt Snack Bar 40g,£1.40,https://www.sainsburys.co.uk/shop/gb/groceries/product/details/kind-nuts---spices-caramel-almond---sea-salt-bar-40g
Snickers Caramel Nougat Peanuts & Milk Chocolate Snack Bar 48g,95p,https://www.sainsburys.co.uk/shop/gb/groceries/product/details/snickers-single-58g
Nakd Blueberry Muffin Fruit & Nut Bar 35g,£1.00,https://www.sainsburys.co.uk/shop/gb/groceries/product/details/nakd-bar-blueberry-muffin-35g
Walkers Salt & Vinegar Crisps 45g,£1.10,https://www.sainsburys.co.uk/shop/gb/groceries/product/details/walkers-salt-vinegar-crisps-45g
McCoy's Salt and Malt Vinegar Grab Bag Crisps 45g,£1.10,https://www.sainsburys.co.uk/shop/gb/groceries/product/details/mccoys-salt---vinegar-50g
Walkers Wotsits Really Cheesy Crisp Snacks 36g,£1.10,https://www.sainsburys.co.uk/shop/gb/groceries/product/details/walkers-wotsits-really-cheesy-crisp-snacks-36g
Sainsbury's On the Go Roasted & Salted Mixed Nuts 60g,£1.05,https://www.sainsburys.co.uk/shop/gb/groceries/product/details/sainsburys-on-the-go-roasted-salted-mixed-nuts-60g
Graze Snack Box Oat Boosts Peanut Butter Protein Flapjack 50g,£1.20,https://www.sainsburys.co.uk/shop/gb/groceries/product/details/graze-peanut-butter-chcolate-fjack-50g
Cadbury Picnic Chocolate Bar 48g,£1.05,https://www.sainsburys.co.uk/shop/gb/groceries/product/details/cadbury-picnic-484g
Sainsbury's Trio Of Olives 60g,£1.30,https://www.sainsburys.co.uk/shop/gb/groceries/product/details/sainsburys-trio-of-olives-60g
Mega Monster Munch Pickled Onion Snacks Crisps 40g,£1.10,https://www.sainsburys.co.uk/shop/gb/groceries/product/details/monster-munch-pickled-onion-40g-6853491-p-44
Sainsbury's On the Go Pineapple 160g,£1.35,https://www.sainsburys.co.uk/shop/gb/groceries/product/details/sainsburys-on-the-go-pineapple-160g
Kinder Bueno Milk Chocolate & Hazelnuts Single Bar 2x21.5g,£1.00,https://www.sainsburys.co.uk/shop/gb/groceries/product/details/kinder-bueno-43g
Twix Caramel & Milk Chocolate Fingers Biscuit Snack Bar 50g,95p,https://www.sainsburys.co.uk/shop/gb/groceries/product/details/twix-twin-58g
Sainsbury's Food To Go Roasted Cashews 23g,80p,https://www.sainsburys.co.uk/shop/gb/groceries/product/details/sainsburys-food-to-go-roasted-cashews-23g
Cadbury Flake Chocolate Bar 32g,£1.05,https://www.sainsburys.co.uk/shop/gb/groceries/product/details/cadbury-flake-32g
Trek Millionaire Shortbread Power Protein Bar 55g,£1.95,https://www.sainsburys.co.uk/shop/gb/groceries/product/details/trek-power-millionaire-shortbread-protein-bar-55g
Aero Peppermint Chocolate Bar 36g,95p,https://www.sainsburys.co.uk/shop/gb/groceries/product/details/aero-peppermint-bubbly-bar-40g
Skips Prawn Cocktail Grab Bag Crisps 35g,£1.10,https://www.sainsburys.co.uk/shop/gb/groceries/product/details/skips-prawn-cocktail-40g
Walkers Prawn Cocktail Crisps 45g,£1.10,https://www.sainsburys.co.uk/shop/gb/groceries/product/details/walkers-prawn-cocktail-crisps-45g
Cadbury Dairy Milk Caramel Chocolate Bar Single 45g,£1.05,https://www.sainsburys.co.uk/shop/gb/groceries/product/details/cadbury-caramel-bar--single-45g
"Batchelors Big Pasta 'n' Sauce, Cheese & Broccoli 85g",£1.20,https://www.sainsburys.co.uk/shop/gb/groceries/product/details/batchelors-big-pasta-sauce-cheese-broccoli-85g
Sainsbury's Apple & Grape 130g,£1.35,https://www.sainsburys.co.uk/shop/gb/groceries/product/details/sainsburys-apple-grape-130g
Galaxy Smooth Milk Chocolate Snack Bar Vegetarian 42g,95p,https://www.sainsburys.co.uk/shop/gb/groceries/product/details/galaxy-milk-46g
Jacob's Mini Cheddars Original Crisps 45g,£1.00,https://www.sainsburys.co.uk/shop/gb/groceries/product/details/mini-cheddars--original-50g
Serious Pig Snacking Pickles 40g,£1.35,https://www.sainsburys.co.uk/shop/gb/groceries/product/details/serious-pig-snacking-pickles-40g
Kinder Bueno White Chocolate & Hazelnuts Bar 39g,£1.00,https://www.sainsburys.co.uk/shop/gb/groceries/product/details/kinder-bueno-white-single-39g
Walkers Baked Cheese & Onion Crisps Snacks 37.5g,£1.10,https://www.sainsburys.co.uk/shop/gb/groceries/product/details/walkers-baked-cheese---onion-crisps-375g
Trek Peanut Butter Crunch Power Protein Bar 55g,£1.95,https://www.sainsburys.co.uk/shop/gb/groceries/product/details/trek-power-peanut-butter-crunch-protein-bar-55g
Sainsbury's On the Go Fruit & Nut Mix 25g,80p,https://www.sainsburys.co.uk/shop/gb/groceries/product/details/sainsburys-on-the-go-fruit---nut-mix-25g
Galaxy Ripple Milk Chocolate Snack Bar 33g,95p,https://www.sainsburys.co.uk/shop/gb/groceries/product/details/galaxy-ripple-33g
Taste Original Chicken Satay Skewers & Sweet Chilli Dip 55g,£1.75,https://www.sainsburys.co.uk/shop/gb/groceries/product/details/taste-original-chicken-satay-skewers-sweet-chilli-dip-55g
Walkers Baked Sea Salt Snacks Crisps 37.5g,£1.10,https://www.sainsburys.co.uk/shop/gb/groceries/product/details/walkers-baked-ready-salted-crisps-375g
McCoy's Thai Sweet Chicken Grab Bag Crisps 45g,£1.10,https://www.sainsburys.co.uk/shop/gb/groceries/product/details/mccoys-thai-sweet-chicken-crisps-475g
Serious Pig Crunchy Snacking Cheese 24g,£1.35,https://www.sainsburys.co.uk/shop/gb/groceries/product/details/serious-pig-snacking-cheese-classic-24g
KitKat Chunky Milk Chocolate Bar 40g,95p,https://www.sainsburys.co.uk/shop/gb/groceries/product/details/kit-kat-chunky-milk-chocolate-bar-40g-7731107-p
Trek Salted Caramel Protein Flapjack 50g,£1.65,https://www.sainsburys.co.uk/shop/gb/groceries/product/details/trek-salted-caramel-flapjack-50g
Urban Fruit Gently Baked Mango 35g,85p,https://www.sainsburys.co.uk/shop/gb/groceries/product/details/urban-fruit-magnificent-mango-35g
Peperami Original 22.5g,£1.30,https://www.sainsburys.co.uk/shop/gb/groceries/product/details/peperami-original-225g-7858180-p-44
Sainsbury's On the Go Watermelon 160g,£1.35,https://www.sainsburys.co.uk/shop/gb/groceries/product/details/sainsburys-on-the-go-watermelon-160g
Yorkie Raisin & Biscuit Milk Chocolate Bar 44g,95p,https://www.sainsburys.co.uk/shop/gb/groceries/product/details/yorkie-raisin---biscuit-milk-chocolate-bar-46g-7731232-p
Walkers Roast Chicken Crisps 45g,£1.10,https://www.sainsburys.co.uk/shop/gb/groceries/product/details/walkers-roast-chicken-crisps-45g
Sainsbury's Millionaires Slice 50g,£1.00,https://www.sainsburys.co.uk/shop/gb/groceries/product/details/sainsburys-millionaires-slice-50g
Yorkie Original Milk Chocolate Bar 46g,95p,https://www.sainsburys.co.uk/shop/gb/groceries/product/details/yorkie-original-milk-chocolate-bar-46g-7730980-p
Mega Monster Munch Roast Beef Snacks Crisps 40g,£1.10,https://www.sainsburys.co.uk/shop/gb/groceries/product/details/monster-munch-roast-beef-40g-7067811-p-44
Sainsbury's Food To Go Mango 25g,80p,https://www.sainsburys.co.uk/shop/gb/groceries/product/details/sainsburys-food-to-go-mango-25g
Sainsbury's On the Go Nut Medley 20g,80p,https://www.sainsburys.co.uk/shop/gb/groceries/product/details/sainsburys-on-the-go-nut-medley-20g
Kellogg's Rice Krispies Squares Marshmallow 28g,95p,https://www.sainsburys.co.uk/shop/gb/groceries/product/details/kelloggs-rice-krispies-squares-marshmallow-28g
Fridge Raiders Slow Roasted Chicken Bites Meal Deal 45g,£1.30,https://www.sainsburys.co.uk/shop/gb/groceries/product/details/fridge-raiders-slow-roasted-chicken-bites-meal-deal-50g
Sainsbury's On the Go Melon Medley 160g,£1.35,https://www.sainsburys.co.uk/shop/gb/groceries/product/details/sainsburys-on-the-go-melon-medley-160g
Sainsbury's On the Go Salt & Vinegar Chickpeas 50g,£1.05,https://www.sainsburys.co.uk/shop/gb/groceries/product/details/sainsburys-on-the-go-salt-vinegar-chickpeas-50g
Sainsbury's All Butter Flapjack 50g,£1.00,https://www.sainsburys.co.uk/shop/gb/groceries/product/details/sainsburys-all-butter-flapjack-50g
Sainsbury's Sweet Potato Bhaji 64g,£1.30,https://www.sainsburys.co.uk/shop/gb/groceries/product/details/sainsburys-sweet-potato-bhaji-64g
Sainsbury's Pineapple & Mango 160g,£1.35,https://www.sainsburys.co.uk/shop/gb/groceries/product/details/sainsburys-pineapple-mango-160g
Urban Fruit Gently Baked Strawberries 35g,85p,https://www.sainsburys.co.uk/shop/gb/groceries/product/details/urban-fruit-smashing-strawberry-35g
Sainsbury's On the Go Scotch Egg 113g,£1.30,https://www.sainsburys.co.uk/shop/gb/groceries/product/details/sainsburys-on-the-go-scotch-egg-113g
Nature Valley Crunchy Oats & Honey Cereal Bar 42g,75p,https://www.sainsburys.co.uk/shop/gb/groceries/product/details/nature-valley-oats-n-honey-42g
Sainsbury's Double Chocolate Brownie 50g,£1.00,https://www.sainsburys.co.uk/shop/gb/groceries/product/details/sainsburys-double-chocolate-brownie-50g
Sainsbury's Cocktail Sausages & Tomato Ketchup 98g,£1.30,https://www.sainsburys.co.uk/shop/gb/groceries/product/details/sainsburys-cocktail-sausages-heinz-ketchup-98g
Lindahls High Protein Strawberry Sundae Pro + Kvarg 150g,£1.40,https://www.sainsburys.co.uk/shop/gb/groceries/product/details/lindahls-strawberry-sundae-pro-kvarg-150g
San Pellegrino Lemon 330ml,£1.30,https://www.sainsburys.co.uk/shop/gb/groceries/product/details/san-pellegrino-lemon-330ml
Sainsbury's On the Go Wasabi Peas 50g,£1.05,https://www.sainsburys.co.uk/shop/gb/groceries/product/details/sainsburys-on-the-go-wasabi-peas-50g
Peperami Single Hot 22.5g,£1.30,https://www.sainsburys.co.uk/shop/gb/groceries/product/details/peperami-single-hot-225g
Trek Power Biscoff Protein Bar 55g,£1.95,https://www.sainsburys.co.uk/shop/gb/groceries/product/details/trek-power-biscoff-protein-bar-55g
Walkers Smoky Bacon Crisps 45g,£1.10,https://www.sainsburys.co.uk/shop/gb/groceries/product/details/walkers-smoky-bacon-crisps-45g
Cadbury Twirl Orange Chocolate Bar 43g,£1.05,https://www.sainsburys.co.uk/shop/gb/groceries/product/details/cadbury-twirl-orange-chocolate-bar-43g
Love Corn Smoked BBQ Roasted Corn Snack 45g,£1.10,https://www.sainsburys.co.uk/shop/gb/groceries/product/details/love-corn-smoked-bbq-roasted-corn-snack-45g
McCoy's Steak Flavour Flame Grilled Potato Crisps 45g,£1.10,https://www.sainsburys.co.uk/shop/gb/groceries/product/details/mccoys-flame-grilled-steak-flavour-potato-crisps-45g
Hula Hoops Salt & Vinegar Flavour Big Hoops Sharp 45g,£1.10,https://www.sainsburys.co.uk/shop/gb/groceries/product/details/hula-hoops-big-hoops-sharp-salt-vinegar-flavour-45g
Sainsbury's On the Go Almonds 25g,70p,https://www.sainsburys.co.uk/shop/gb/groceries/product/details/sainsburys-on-the-go-almonds-25g
Graze Snack Box Marmite Crunch Mix 28g,£1.20,https://www.sainsburys.co.uk/shop/gb/groceries/product/details/graze-marmite-crunch-28g
Sainsbury's Mini Pork Pies x2 100g,£1.30,https://www.sainsburys.co.uk/shop/gb/groceries/product/details/sainsburys-mini-pork-pies-x2-100g
Yorkie Duo Chocolate Bar 72g,£1.15,https://www.sainsburys.co.uk/shop/gb/groceries/product/details/yorkie-duo-chocolate-bar-72g
Love Corn Sea Salt Delicious Crunchy Corn 45g,£1.10,https://www.sainsburys.co.uk/shop/gb/groceries/product/details/love-corn-sea-salt-crunchy-corn-45g
Kit Kat Chunky Duo Milk Chocolate Chocolate Bar 64g,£1.15,https://www.sainsburys.co.uk/shop/gb/groceries/product/details/kitkat-chunky-duo-64g
McVitie's Jaffa Cake Jonuts Biscuits Single Serve Pack,85p,https://www.sainsburys.co.uk/shop/gb/groceries/product/details/mcvities-jaffa-cake-jonuts-biscuits-single-serve-pack
Yorkie Raisin & Biscuit Chocolate Duo Bar 66g,£1.15,https://www.sainsburys.co.uk/shop/gb/groceries/product/details/yorkie-raisin-biscuit-chocolate-duo-bar-66g
Kellogg's Nutri-Grain Morning Bar Strawberry 37g,85p,https://www.sainsburys.co.uk/shop/gb/groceries/product/details/kelloggs-nutrigrain-morning-bars-strawberry-x1-37g
Nature Valley Protein Peanut & Chocolate Cereal Bars 40g,£1.10,https://www.sainsburys.co.uk/shop/gb/groceries/product/details/nature-valley-protein-bar-peanut-chocolate-40g
Cadbury Mini Rolls Milk Chocolate On The Go x2,£1.10,https://www.sainsburys.co.uk/shop/gb/groceries/product/details/cadbury-mini-milk-chocolate-rolls-x2
Walkers Oven Baked Prawn Cocktail Flavoured Crisp Snacks 37.5g,£1.10,https://www.sainsburys.co.uk/shop/gb/groceries/product/details/walkers-baked-prawn-cocktail-snack-375g
Discos Salt & Vinegar Grab Bag Crisps 50g,£1.10,https://www.sainsburys.co.uk/shop/gb/groceries/product/details/discos-salt-vinegar-grab-bag-crisps-50g
McVitie's Gold Billions Wafer Golden Caramel Chocolate 39g,85p,https://www.sainsburys.co.uk/shop/gb/groceries/product/details/mcvities-gold-billions-wafer-golden-caramel-chocolate-39g
Kind Maple Pecan Almond Snack Bar 40g,£1.40,https://www.sainsburys.co.uk/shop/gb/groceries/product/details/kind-maple-pecan-almond-snack-bar-40g
Urban Fruit Gently Baked Pineapple 35g,£1.10,https://www.sainsburys.co.uk/shop/gb/groceries/product/details/urban-fruit-perfect-pineapple-35g
Sainsbury's Sausage Roll 90g,£1.30,https://www.sainsburys.co.uk/shop/gb/groceries/product/details/sainsburys-sausage-roll-90g
Walkers Less Salt Lightly Salted Crisps 45g,£1.10,https://www.sainsburys.co.uk/shop/gb/groceries/product/details/walkers-less-salt-lightly-salted-crisps-45g
McCoy's Ridge Cut Cheddar & Onion Flavour Potato Crisps 45g,£1.10,https://www.sainsburys.co.uk/shop/gb/groceries/product/details/mccoys-ridge-cut-cheddar-onion-flavour-potato-crisps-45g
Kinder Medium Chocolate Multipack Bars 2x21g,85p,https://www.sainsburys.co.uk/shop/gb/groceries/product/details/kinder-medium-chocolate-multipack-bars-2x21g
Fridge Raiders Southern Style Chicken Bites Meal Deal 45g,£1.30,https://www.sainsburys.co.uk/shop/gb/groceries/product/details/fridge-raiders-southern-style-chicken-bites-meal-deal-50g
KP Roasted Peanuts Dry Snack Pack 30g,70p,https://www.sainsburys.co.uk/shop/gb/groceries/product/details/kp-snack-pack-dry-roasted-peanuts-30g
Cadbury Boost Duo Chocolate Bar 63g,£1.30,https://www.sainsburys.co.uk/shop/gb/groceries/product/details/cadbury-boost-duo-chocolate-bar-63g
Higgidy Cheddar & Caramelised Onion Chutney Rolls,£1.50,https://www.sainsburys.co.uk/shop/gb/groceries/product/details/higgidy-cheddar-onion-chutney-veggie-rolls-54g
Cadbury Starbar Duo Chocolate Bar 74g,£1.30,https://www.sainsburys.co.uk/shop/gb/groceries/product/details/cadbury-starbar-duo-chocolate-bar-74g
Higgidy Ham Hock & Cheddar Sausage Rolls 54g,£1.50,https://www.sainsburys.co.uk/shop/gb/groceries/product/details/higgidy-ham-hock-cheddar-sausage-rolls-54g
Graze Cherry Bakewell Fibre Flapjack 53g,£1.20,https://www.sainsburys.co.uk/shop/gb/groceries/product/details/graze-cherry-bakewell-fibre-flapjack-53g
Love Corn Salt & Vinegar Crunchy Corn Snack 45g,£1.10,https://www.sainsburys.co.uk/shop/gb/groceries/product/details/love-corn-salt-vinegar-45g
Sainsbury's Free From Chocolate Brownie Bar 50g,£1.20,https://www.sainsburys.co.uk/shop/gb/groceries/product/details/sainsburys-free-from-chocolate-brownie-50g
Walkers Less Salt Mild Cheese & Onion Crisps 45g,£1.10,https://www.sainsburys.co.uk/shop/gb/groceries/product/details/walkers-less-salt-mild-cheese-onion-crisps-45g
Cathedral City Snack Bar Original Mature Cheddar Cheese 24g,£1.30,https://www.sainsburys.co.uk/shop/gb/groceries/product/details/cathedral-city-snack-bar-original-cheese-24g
Kind Fruit & Nut Snack Bar 40g,£1.40,https://www.sainsburys.co.uk/shop/gb/groceries/product/details/kind-fruit-nut-snack-bar-40g
Itsu Sweet Chilli Prawn Crackers 19g,80p,https://www.sainsburys.co.uk/shop/gb/groceries/product/details/itsu-sweet-chilli-prawn-crackers-19g
Jammie Dodgers Raspberry Flavour Giant Jammie 50g,£1.00,https://www.sainsburys.co.uk/shop/gb/groceries/product/details/jammie-dodgers-raspberry-flavour-giant-jammie-50g
Cadbury Dairy Milk Chocolate Duo Bar 54.4g,£1.30,https://www.sainsburys.co.uk/shop/gb/groceries/product/details/cadbury-dairy-milk-duo-chocolate-bars-544g
Walkers Baked Salt & Vinegar Crisps Snacks 37.5g,£1.10,https://www.sainsburys.co.uk/shop/gb/groceries/product/details/walkers-baked-salt-vinegar-snack-375g
KIND Protein Crunchy Peanut Butter Snack Bar 50g,£2.20,https://www.sainsburys.co.uk/shop/gb/groceries/product/details/kind-protein-crunchy-peanut-butter-50g
Sainsbury's Fruit & Seed Granola 50g,£1.00,https://www.sainsburys.co.uk/shop/gb/groceries/product/details/sainsburys-fruit-seed-granola-50g
Popworks Sweet & Salty Popped Crisps 28g,£1.10,https://www.sainsburys.co.uk/shop/gb/groceries/product/details/popworks-sweet-salty-popped-crisps-28g
Kellogg's Nutri-Grain Bakes Raisin 45g,85p,https://www.sainsburys.co.uk/shop/gb/groceries/product/details/kelloggs-nutri-grain-elevenses-raisin-bake-45g
Love Corn Cheese & Onion Premium Crunchy Corn 45g,£1.10,https://www.sainsburys.co.uk/shop/gb/groceries/product/details/love-corn-cheese-onion-premium-crunchy-corn-45g
N?kd Protein Bar Peanut Butter 45g,£1.45,https://www.sainsburys.co.uk/shop/gb/groceries/product/details/nakd-peanut-butter-protein-bar-45g
Nakd Cocoa Hazelnut Protein Bar 45g,£1.45,https://www.sainsburys.co.uk/shop/gb/groceries/product/details/nakd-cocoa-hazelnut-protein-bar-45g
itsu Crispy Seaweed Thins Sea Salt 5g,£1.00,https://www.sainsburys.co.uk/shop/gb/groceries/product/details/itsu-crispy-seaweed-thins-sea-salt-5g
Walkers Sensations Thai Sweet Chilli Grab Bag Crisps 40g,£1.00,https://www.sainsburys.co.uk/shop/gb/groceries/product/details/walkers-sensations-thai-sweet-chilli-grab-bag-crisps-40g
Doritos Tangy Cheese Tortilla Chips Grab Bag Crisps 48g,£1.00,https://www.sainsburys.co.uk/shop/gb/groceries/product/details/doritos-tangy-cheese-tortilla-chips-grab-bag-crisps-48g
Grenade Oreo Protein Bar 35g,£2.15,https://www.sainsburys.co.uk/shop/gb/groceries/product/details/grenade-oreo-35g
Eat Natural Protein Peanuts Dark Chocolate Fruit & Nut Bars 40g,£1.25,https://www.sainsburys.co.uk/shop/gb/groceries/product/details/eat-natural-protein-peanuts-dark-chocolate-fruit-nut-bars-40g
Doritos Cool Original Tortilla Chips Grab Bag Crisps 48g,£1.00,https://www.sainsburys.co.uk/shop/gb/groceries/product/details/doritos-cool-original-tortilla-chips-grab-bag-crisps-48g
Squares Chocolatey Rice Krispies 36g,95p,https://www.sainsburys.co.uk/shop/gb/groceries/product/details/kelloggs-rice-krispies--totally-chocolate-36g
Pipers Anglesey Sea Salt Crisps 40g,£1.35,https://www.sainsburys.co.uk/shop/gb/groceries/product/details/pipers-anglesey-sea-salt-crisps-40g
Pick Up! Original 28g,85p,https://www.sainsburys.co.uk/shop/gb/groceries/product/details/pick-up%21-original-28g
Doritos Chilli Heatwave Tortilla Chips Grab Bag Crisps 48g,£1.00,https://www.sainsburys.co.uk/shop/gb/groceries/product/details/doritos-chilli-heatwave-tortilla-chips-grab-bag-crisps-48g
Grenade Oreo White Protein Bar 35g,£2.15,https://www.sainsburys.co.uk/shop/gb/groceries/product/details/grenade-oreo-white-35g
Pipers Great Berwick Longhorn Beef Crisps 40g,£1.35,https://www.sainsburys.co.uk/shop/gb/groceries/product/details/pipers-great-berwick-longhorn-beef-crisps-40g
Pipers Biggleswade Sweet Chilli Crisps 40g,£1.35,https://www.sainsburys.co.uk/shop/gb/groceries/product/details/pipers-biggleswade-sweet-chilli-crisps-40g
Kind Chocolate Chip Cashew Cereal Bar 40g,£1.40,https://www.sainsburys.co.uk/shop/gb/groceries/product/details/kind-chocolate-chip-cashew-nut-bar-40g
